{
  "$schema": "../schema/component-intent.schema.json",
  "component": "badge",
  "maturity": "stable",
  "description": "Solid/surface + semantic sets are faithful to prod @atom63/ui badge.tsx. Palette hues back category/tag colors via the `--a63-badge-*` contract in @atom63/styles (which references foundation --color-* primitives).",
  "lists": {
    "solidVariants": {
      "values": [
        "default",
        "primary",
        "secondary",
        "destructive",
        "outline",
        "glass",
        "muted",
        "accent"
      ],
      "typed": false
    },
    "semanticVariants": {
      "values": ["error", "info", "success", "warning"],
      "typed": false
    },
    "paletteVariants": {
      "values": [
        "red",
        "orange",
        "amber",
        "yellow",
        "lime",
        "green",
        "emerald",
        "teal",
        "cyan",
        "sky",
        "blue",
        "indigo",
        "violet",
        "purple",
        "fuchsia",
        "pink",
        "rose",
        "neutral"
      ],
      "typed": false
    },
    "variants": {
      "concat": ["solidVariants", "semanticVariants", "paletteVariants"]
    },
    "sizes": ["sm", "md", "lg"],
    "slots": ["badge"],
    "states": ["resting", "interactive", "disabled", "focus-visible"],
    "visualArchetypes": ["marker"]
  },
  "contract": {
    "defaultVariant": "default",
    "defaultSize": "md",
    "variants": {
      "$ref": "#/lists/variants"
    },
    "sizes": {
      "$ref": "#/lists/sizes"
    },
    "slots": {
      "$ref": "#/lists/slots"
    },
    "states": {
      "$ref": "#/lists/states"
    },
    "visualArchetypes": {
      "$ref": "#/lists/visualArchetypes"
    }
  },
  "intent": {
    "description": "What a badge says, independent of any platform: its tone (the kind of status or meaning) and its emphasis (how strongly it is drawn). The palette hues are a web extension for categories that carry no status.",
    "axes": {
      "tone": ["neutral", "primary", "info", "success", "warning", "error"],
      "emphasis": ["solid", "soft", "outline"]
    },
    "platforms": {
      "web": {
        "props": {
          "variant": {
            "list": "variants",
            "map": {
              "default": {
                "tone": "neutral",
                "emphasis": "solid"
              },
              "primary": {
                "tone": "primary",
                "emphasis": "solid"
              },
              "secondary": {
                "tone": "neutral",
                "emphasis": "soft"
              },
              "outline": {
                "tone": "neutral",
                "emphasis": "outline"
              },
              "destructive": {
                "tone": "error",
                "emphasis": "solid"
              },
              "error": {
                "tone": "error",
                "emphasis": "soft"
              },
              "info": {
                "tone": "info",
                "emphasis": "soft"
              },
              "success": {
                "tone": "success",
                "emphasis": "soft"
              },
              "warning": {
                "tone": "warning",
                "emphasis": "soft"
              }
            },
            "extensions": {
              "glass": {
                "description": "A translucent surface with a hairline, for badges over imagery."
              },
              "muted": {
                "description": "A quieter neutral on the muted surface."
              },
              "accent": {
                "description": "A neutral on the control hover surface."
              },
              "red": {
                "description": "A palette hue for a category with no status.",
                "group": "hue"
              },
              "orange": {
                "description": "A palette hue for a category with no status.",
                "group": "hue"
              },
              "amber": {
                "description": "A palette hue for a category with no status.",
                "group": "hue"
              },
              "yellow": {
                "description": "A palette hue for a category with no status.",
                "group": "hue"
              },
              "lime": {
                "description": "A palette hue for a category with no status.",
                "group": "hue"
              },
              "green": {
                "description": "A palette hue for a category with no status.",
                "group": "hue"
              },
              "emerald": {
                "description": "A palette hue for a category with no status.",
                "group": "hue"
              },
              "teal": {
                "description": "A palette hue for a category with no status.",
                "group": "hue"
              },
              "cyan": {
                "description": "A palette hue for a category with no status.",
                "group": "hue"
              },
              "sky": {
                "description": "A palette hue for a category with no status.",
                "group": "hue"
              },
              "blue": {
                "description": "A palette hue for a category with no status.",
                "group": "hue"
              },
              "indigo": {
                "description": "A palette hue for a category with no status.",
                "group": "hue"
              },
              "violet": {
                "description": "A palette hue for a category with no status.",
                "group": "hue"
              },
              "purple": {
                "description": "A palette hue for a category with no status.",
                "group": "hue"
              },
              "fuchsia": {
                "description": "A palette hue for a category with no status.",
                "group": "hue"
              },
              "pink": {
                "description": "A palette hue for a category with no status.",
                "group": "hue"
              },
              "rose": {
                "description": "A palette hue for a category with no status.",
                "group": "hue"
              },
              "neutral": {
                "description": "A palette hue for a category with no status.",
                "group": "hue"
              }
            }
          }
        }
      },
      "ios": {
        "props": {
          "tone": {
            "swiftType": "AtomBadgeTone",
            "map": {
              "neutral": {
                "tone": "neutral",
                "emphasis": "soft"
              },
              "accent": {
                "tone": "primary",
                "emphasis": "solid"
              },
              "info": {
                "tone": "info",
                "emphasis": "soft"
              },
              "success": {
                "tone": "success",
                "emphasis": "soft"
              },
              "warning": {
                "tone": "warning",
                "emphasis": "soft"
              },
              "error": {
                "tone": "error",
                "emphasis": "soft"
              }
            },
            "extensions": {},
            "aliases": {
              "danger": "error"
            }
          }
        }
      }
    },
    "stateAliases": {
      "resting": "rest"
    }
  },
  "crossRenderer": {
    "foundationAxis": "variants",
    "catalogItem": "badge",
    "reactRenderer": "Badge",
    "swiftUIRenderer": "AtomBadge",
    "intent": "Communicate a compact label or semantic status alongside primary content.",
    "parity": "strict",
    "requiredStates": ["neutral", "accent", "success", "warning", "error"],
    "sharedOutcomes": ["label-remains-readable-without-color", "semantic-tone-retains-meaning"],
    "accessibilityOutcomes": ["text-does-not-rely-on-color"],
    "platformAdaptations": {
      "react": ["May expose palette-only decorative variants outside the shared semantic subset."],
      "swiftUI": ["Uses a compact capsule that expands for Dynamic Type."]
    }
  }
}
