{
  "$schema": "../schema/component-intent.schema.json",
  "component": "popover",
  "maturity": "stable",
  "lists": {
    "states": ["closed", "open", "starting", "ending"],
    "slots": [
      "popover",
      "popover-trigger",
      "popover-anchor",
      "popover-portal",
      "popover-positioner",
      "popover-content",
      "popover-close",
      "popover-header",
      "popover-title",
      "popover-description"
    ],
    "visualArchetypes": ["trigger", "overlay", "surface", "action"]
  },
  "contract": {
    "slots": {
      "$ref": "#/lists/slots"
    },
    "states": {
      "$ref": "#/lists/states"
    },
    "visualArchetypes": {
      "$ref": "#/lists/visualArchetypes"
    }
  }
}
