{
  "$schema": "../schema/component-intent.schema.json",
  "component": "portal-container",
  "maturity": "stable",
  "lists": {
    "targets": ["element", "shadow-root", "null", "undefined"],
    "states": ["unprovided", "pending", "resolved"],
    "visualArchetypes": {
      "values": [],
      "typed": false
    }
  },
  "contract": {
    "states": {
      "$ref": "#/lists/states"
    },
    "targets": {
      "$ref": "#/lists/targets"
    },
    "visualArchetypes": {
      "$ref": "#/lists/visualArchetypes"
    }
  }
}
