{
  "$schema": "../schema/component-intent.schema.json",
  "component": "frame",
  "maturity": "stable",
  "description": "Faithful to prod @atom63/ui frame.tsx — an OS-style window/flyout chrome: an outer \"tray\" surface wrapping inner \"panel\" surfaces, with a shared border weight. Prod modeled this with `cva`; here the variant unions live in the foundation and the recipe keys off data-* attributes (badge/button pattern). Chrome is tray (outer) + panel (inner). `variant` is a named tray+panel PRESET; `tray` / `panel` override the preset surface; `border` is Frame-level (inherited by nested panels, per-panel overridable).",
  "lists": {
    "variants": {
      "description": "Named tray+panel pairs (prod FRAME_PRESETS).",
      "values": ["muted-background", "muted-card"]
    },
    "trays": ["muted", "card", "background"],
    "panelSurfaces": ["background", "card", "muted"],
    "borders": ["off", "subtle", "strong"],
    "slots": [
      "frame",
      "frame-panel",
      "frame-panel-header",
      "frame-panel-title",
      "frame-panel-description",
      "frame-panel-footer"
    ],
    "states": ["default", "border-off", "border-subtle", "border-strong"],
    "visualArchetypes": ["surface"],
    "presets": {
      "description": "Preset → {tray, panel} surface pair. Mirrors prod FRAME_PRESETS.",
      "keys": "variants",
      "fields": {
        "tray": "trays",
        "panel": "panelSurfaces"
      },
      "entries": {
        "muted-background": {
          "tray": "muted",
          "panel": "background"
        },
        "muted-card": {
          "tray": "muted",
          "panel": "card"
        }
      }
    }
  },
  "contract": {
    "defaultVariant": "muted-background",
    "defaultBorder": "strong",
    "variants": {
      "$ref": "#/lists/variants"
    },
    "trays": {
      "$ref": "#/lists/trays"
    },
    "panelSurfaces": {
      "$ref": "#/lists/panelSurfaces"
    },
    "borders": {
      "$ref": "#/lists/borders"
    },
    "slots": {
      "$ref": "#/lists/slots"
    },
    "states": {
      "$ref": "#/lists/states"
    },
    "visualArchetypes": {
      "$ref": "#/lists/visualArchetypes"
    },
    "presets": {
      "$ref": "#/lists/presets"
    }
  }
}
